productId,name,price,image,shortDescription,longDescription
1,Nintendo Switch,29999,/images/switch_console.jpg,"Get The Gaming System That Lets You Play The Games You Want, Wherever You Are, However You Like!","At home, Nintendo Switch™ rests in the Nintendo Switch Dock that connects the system to the TV and lets you play with family and friends in the comfort of your living room. By simply lifting Nintendo Switch from the dock, the system will instantly transition to portable mode, and the same great gaming experience that was being enjoyed at home now travels with you. The portability of Nintendo Switch is enhanced by its bright high-definition display. It brings the full home gaming system experience with you to the park, on an airplane, in a car, or to a friend’s apartment. This bundle includes the Nintendo Switch console and Nintendo Switch dock in black, with contrasting left and right Joy‑Con™ controllers—one red, one blue. It also includes all the extras you need to get started."
2,Nintendo Switch Lite,19999,/images/switch_lite.jpg,"Nintendo Switch Lite is a compact, lightweight Nintendo Switch system dedicated to handheld play.","With a built-in +Control Pad and a sleek, unibody design, it’s great for on-the-go gaming. Nintendo Switch Lite is compatible with the robust library of Nintendo Switch games that support handheld mode. If you’re looking for a gaming system all your own, Nintendo Switch Lite is ready to hit the road whenever you are!"
3,NES Controllers,5999,/images/nesc_package.jpg,"With a Nintendo Switch Online membership, you can play enhanced NES™ games the way they're meant to be played—using full-size Nintendo Entertainment System™ controllers!","Available for purchase only by Nintendo Switch Online members*, this 2-pack of wireless controllers offers the perfect way to play these classic NES games online either competitively or cooperatively. Rechargeable Battery – The Nintendo Entertainment System controllers can be paired and used wirelessly with Nintendo Switch Lite. However, a Nintendo Switch console with detached Joy-Con is required to charge the controllers. Two Controllers – Available as a set of two controllers for competitive and cooperative fun."
4,SNES Controller,2999,/images/snescontroller.jpg,Now you’re playing with super power!,"Enjoy enhanced Super NES™ games the way they're meant to be played—using a full-size Super NES™ style controller! Available for purchase only by Nintendo Switch Online members, this wireless controller offers the perfect way to play these classic Super NES games. What’s in the box — One Super Nintendo Entertainment System Controller and one USB cable. Recharging options — Use the included USB cable or a Nintendo Switch AC adapter."
5,Ostrich Pillow,9900,/images/ostrich-pillow.jpg,Create your own snugly space in the world and feel-good anywhere with the ultimate cocoon pillow.,"Lorem ipsum dolor amet fashion axe pour-over jianbing, adaptogen waistcoat tacos master cleanse pitchfork next level. Thundercats pour-over chartreuse 90's. Master cleanse hot chicken ennui offal. Freegan slow-carb offal hell of. Umami polaroid wolf slow-carb next level. Gentrify cardigan seitan, kombucha tacos chambray roof party typewriter man braid. Tote bag lo-fi hell of chia fam hammock.\nAesthetic photo booth la croix, vaporware leggings biodiesel man braid tumeric skateboard tousled slow-carb four dollar toast synth pabst pickled. Typewriter church-key chia slow-carb vice gochujang actually. Shoreditch austin woke hot chicken, single-origin coffee ugh affogato four loko green juice. Migas iPhone four dollar toast mustache."
6,Pro Controller,6999,/images/procontroller.jpg, "Take your game sessions up a notch with the Pro Controller for Nintendo Switch™.","Its traditional design includes motion controls, two analog control sticks and the ability to read Amiibo figures, and a USB-C cable is provided for charging. This Nintendo Switch pro controller works with any mode, whether the console is docked or undocked."
7,Joy-Con Grip,1999,/images/joycon-holder.jpg, "Combine the left and right Joy‑Con™ into one larger controller with this handy grip.","You can combine the left and right sides to create one large controller that is easier to handle, and the ergonomic design keeps your hand comfortable during all-night gaming sessions. This Nintendo Joy-Con grip protects your controllers from daily wear and tear."
8,NES Classic Edition,4999,/images/nes.jpg, "Play the System that Started it All!","Remember your first Goomba stomp? The NES Classic Edition system is a miniaturized version of the groundbreaking NES, originally released in 1985. Just plug the NES Classic Edition into your TV, pick up that gray controller, and rediscover the joy of NES games. The NES Classic Edition is now available as an Authentic Nintendo Refurbished set only from Nintendo, and it comes with our standard one year warranty. Although it may have minor cosmetic blemishes, it is guaranteed to be fully functional. We think you will find the standards for Authentic Nintendo Refurbished Products are VERY high."
9,Super NES Classic Edition,6999,/images/snes.jpg, "You’ve Been Waiting a Long Time For This!","Trust us, it was worth the wait. The Super NES Classic Edition system looks and feels just like the original ’90s home console, except it’s super small. Play 20 classic Super NES games plus *gasp* the ever-before-released Star Fox™ 2 game! The Super NES Classic Edition is now available as an Authentic Nintendo Refurbished set only from Nintendo, and it comes with our standard one year warranty. Although it may have minor cosmetic blemishes, it is guaranteed to be fully functional. We think you will find the standards for Authentic Nintendo Refurbished Products are VERY high."
10,Mario Kart 8 Deluxe,5999,/images/m_kart.jpg, "Race and Battle Your Friends in the Definitive Version of Mario Kart 8!","Hit the road with the definitive version of Mario Kart™ 8 and play anytime, anywhere! Race your friends or battle them in a revised battle mode on new and returning battle courses. Play locally in up to 4-player multiplayer in 1080p while playing in TV Mode. Every track from the Wii U™ version, including DLC, makes a glorious return. Plus, the Inklings appear as all-new guest characters, along with returning favorites, such as King Boo, Dry Bones, and Bowser Jr.! Add to the fun with a Joy-Con™ Wheel (available separately)!"
11,Super Smash Bros. Ultimate,5999,/images/m_smash.jpg, "A New Super Smash Bros. Game with New Fighters, Stages, and More!","Legendary game worlds and fighters collide in the ultimate showdown—a new entry in the Super Smash Bros. series for the Nintendo Switch system! New fighters, like Inkling from the Splatoon series and Ridley from the Metroid series, make their Super Smash Bros. series debut alongside every Super Smash Bros. fighter in the series…EVER! Faster combat, new items, new attacks, new defensive options, and more will keep the battle raging whether you’re at home or on the go."
12,New Super Mario Bros. U Deluxe,5999,/images/m_deluxe.jpg, "Join Mario, Luigi, and pals for single-player or multiplayer fun anytime, anywhere!","Take on two family-friendly, side-scrolling adventures with up to three friends* as you try to save the Mushroom Kingdom. Includes the New Super Mario Bros. U and harder, faster New Super Luigi U games — both of which include Nabbit and Toadette as playable characters! Two games in one, for double the fun! Simple, straightforward controls, new playable characters optimized for younger and less-experienced players, and a wealth of bonus content—like a Hints gallery and helpful reference videos**—make this a perfect choice for anyone looking to introduce their family to the wonderful world of Mario. All a player needs is one Joy-Con™ controller, so two people can team up right out of the box! Tackle 164 platforming courses in the two main game modes and enjoy extra replayability with three additional game modes in which you can also play as a Mii™ character: Challenges, Boost Rush, and Coin Battle!"